"Speaker Name","Start Time","End Time","Text""Speaker 1","01;24;03;22","01;24;32;00","Rigby. And, and and in 1922, when he was going to high school here away. He was. As I was looking at some, History that we had an, on the computer. It was written by his wife as he was listing the field. He got the idea of how he could produce pictures electronically."
"Speaker 1","01;24;32;02","01;24;59;01","Well, as they say, he was, according to either his wife or they were just getting a feel to look back and saw the various, roses created by the disc in the field. He thought he could produce pictures, like, chronically, because ill been going to studying about electrons and stuff and do it one line at a time very rapidly, which is exactly how pictures were originally made for television."
"Speaker 1","01;24;59;04","01;25;27;11","Well, he, was talking with his, high school teachers explaining how he thought he could produce pictures, electronically, basically television. And there's, he made a drawing on the chalkboard for his teacher explaining basically how the camera tube would work. And, as he was explaining that teachers thought the idea could possibly work. He thought about it."
"Speaker 1","01;25;27;12","01;25;51;24","Wonder what he made this drawing of on the chalkboard in the high school for his teacher. And, he, the, you know, the classroom. His teacher made a copy of that drawing. They kept it. That became very important for Farnsworth later on. Farnsworth applied for a patent for that particular process. He did receive the patent RCA with electronic giant of the day."
"Speaker 1","01;25;51;26","01;26;15;17","And, they disputed his that they don't know. We came up with the idea first. Exactly what went to court on that? His teacher found out what was going on and actually went back and testified before the patent committee as to the exact date the Farnsworth came up with the idea. So far, defense was able to keep that pattern."
"Speaker 1","01;26;15;19","01;26;19;28","It ended up costing RCA $1 million for the use of that particular process."
"Speaker 1","01;26;20;00","01;26;45;09","He did create his own company. He, entered the market at about the worst by a year, possibly entered the market during the depression. The first TV that he produced actually was not produced here in Rigby, Idaho, which trying to be the birthplace of deliberation because he came up with the idea while he was here. The first TV he produced was not produced."
"Speaker 1","01;26;45;11","01;26;51;03","That was produced in San Francisco, California, where he received some financial backing."
"Speaker 1","01;26;51;05","01;27;17;17","they're not necessarily exact tubes that he would use, the tubes that Farnsworth did present to the high school. The first original tubes are no longer here, and Rigby, they were in our in our Rigby High school. They were stored in the library, in a special case in the in the library. Rigby High school library."
"Speaker 1","01;27;17;20","01;27;35;04","Years ago, there were some banned. There was some vandalism took place in the high school. They did not touch the tubes. The principal was very concerned that that something might happen to him. So he basically gave our tubes away. They ended up in BYU. Provo."
"Speaker 1","01;27;35;06","01;27;46;21","His family moved back to the Provo, Utah area. From here. Farnsworth did not graduate from high school here. He actually graduated from high school in Provo, Utah."
"Speaker 1","01;27;46;24","01;27;57;04","He did attend Brigham Young University of Provo. He had to drop out to help support his family financially. Before he received his degree."
"Speaker 1","01;27;57;07","01;28;21;13","We said was basically set up to, display how various communities around the area would have looked, a number of years ago, agricultural, when one area was, Megan schools like, of course, the Rigby areas. Was the Rigby area."
"Speaker 1","01;28;21;15","01;28;27;03","There's so many things in here that, I,"
"Speaker 1","01;28;27;05","01;28;35;10","Enjoy. I've used a lot of the things that were in here. I'm not a young person by any means."
"Speaker 1","01;28;35;12","01;28;58;17","Most have seen that, reclining with the sign outside of the times of the read The Birthplace of Television. So I enjoyed telling him why we make that claim. A lot of them, the misconception that Farnsworth was born here, that is not the case. They have a misconception that the first TV he produced was actually made here."
"Speaker 1","01;28;58;19","01;29;08;00","There again, that is not the case. So it brings up the chance to bring up some to clear up some misconceptions that people have certainly."
"Speaker 1","01;29;08;02","01;29;14;16","Well, most of us watch TV, and it wouldn't be here if it wasn't for foreign, diverse."
"Speaker 1","01;29;14;19","01;29;40;17","the snow plain. It's what they're called. They were, never commercially produced. The snow plain is does not fly. It actually goes across the snow. They work much like a swamp boat. The propellers and the back of them. And, as I said, they were never commercially produced. Years ago, there was, in Roberts, Idaho."
"Speaker 1","01;29;40;17","01;29;59;07","They did a, a short haul, usually around the 1st of January, and they would do various races and stuff. And then those things were actually raced during that carnival, along with chariot races and all kinds of stuff that went on during that."
"Speaker 1","01;29;59;09","01;30;28;06","This whole museum is basically things that were used many years ago. A lot of people. And we take them through here. We take, school groups are usually in the in the spring. We do what we call a treasure hunt, which give the items to look for in these particular rooms. And, one of the things that I have to talk to you about is, one of the things we have to look for is a nice."
"Speaker 1","01;30;28;08","01;30;50;01","Now, most people don't know what a hay knife is. A hay knife was used when the hay was not baled, hay was cut and put in a loose stack. The hay knife, if I had one, was would be, I could show you, but they had two handles on, and they were used to cut a section of hay out of that stack."
"Speaker 1","01;30;50;01","01;31;19;09","So, so that you could actually read a section of the livestock. Otherwise it would mat down and be very hard to get out of the stack. And there's just these invasively that myriad of things that in many cases are not reused anymore. Couple of things that I never thought would become obsolete in my lifetime, that I've used extensively."
"Speaker 1","01;31;19;12","01;31;32;18","And, well, one of them is a film camera. A film camera basically is not used anymore. And also a typewriter."
"Speaker 1","01;31;32;20","01;31;44;24","If you don't know what things are, how are you going to improve on and, like, why are these things you know about? Because they weren't happy with the way things were. So they write them better."
